"No.","Time","Source","Destination","Protocol","Length","Info"
"1","0.000000","127.0.0.1","127.0.0.1","TCP","53","61509  >  61499 [PSH, ACK] Seq=1 Ack=1 Win=228 Len=9"
"2","0.000045","127.0.0.1","127.0.0.1","TCP","44","61499  >  61509 [ACK] Seq=1 Ack=10 Win=250 Len=0"
"3","0.001494","127.0.0.1","127.0.0.1","TCP","47","61499  >  61509 [PSH, ACK] Seq=1 Ack=10 Win=250 Len=3"
"4","0.001534","127.0.0.1","127.0.0.1","TCP","44","61509  >  61499 [ACK] Seq=10 Ack=4 Win=228 Len=0"
"5","25.002290","127.0.0.1","127.0.0.1","TCP","53","61509  >  61499 [PSH, ACK] Seq=10 Ack=4 Win=228 Len=9"
"6","25.002343","127.0.0.1","127.0.0.1","TCP","44","61499  >  61509 [ACK] Seq=4 Ack=19 Win=250 Len=0"
"7","25.003559","127.0.0.1","127.0.0.1","TCP","47","61499  >  61509 [PSH, ACK] Seq=4 Ack=19 Win=250 Len=3"
"8","25.003604","127.0.0.1","127.0.0.1","TCP","44","61509  >  61499 [ACK] Seq=19 Ack=7 Win=228 Len=0"
"9","43.886098","::1","::1","TCP","76","60338  >  9222 [SYN] Seq=0 Win=65535 Len=0 MSS=65475 WS=256 SACK_PERM"
"10","43.886119","::1","::1","TCP","64","9222  >  60338 [RST, ACK] Seq=1 Ack=1 Win=0 Len=0"
"11","43.886307","127.0.0.1","127.0.0.1","TCP","56","60339  >  9222 [SYN] Seq=0 Win=65535 Len=0 MSS=65495 WS=256 SACK_PERM"
"12","43.886316","127.0.0.1","127.0.0.1","TCP","44","9222  >  60339 [RST, ACK] Seq=1 Ack=1 Win=0 Len=0"
"13","43.895088","127.0.0.1","127.0.0.1","TCP","56","60341  >  60331 [SYN] Seq=0 Win=65535 Len=0 MSS=65495 WS=256 SACK_PERM"
"14","43.895248","127.0.0.1","127.0.0.1","TCP","56","60331  >  60341 [SYN, ACK] Seq=0 Ack=1 Win=65535 Len=0 MSS=65495 WS=256 SACK_PERM"
"15","43.895294","127.0.0.1","127.0.0.1","TCP","44","60341  >  60331 [ACK] Seq=1 Ack=1 Win=65280 Len=0"
"16","43.898034","127.0.0.1","127.0.0.1","TCP","439","60341  >  60331 [PSH, ACK] Seq=1 Ack=1 Win=65280 Len=395 [TCP PDU reassembled in 18]"
"17","43.898078","127.0.0.1","127.0.0.1","TCP","44","60331  >  60341 [ACK] Seq=1 Ack=396 Win=65024 Len=0"
"18","43.898229","127.0.0.1","127.0.0.1","HTTP","56","POST /exa.extension_server_pb.ExtensionServerService/LanguageServerStarted HTTP/1.1  (application/proto)"
"19","43.898246","127.0.0.1","127.0.0.1","TCP","44","60331  >  60341 [ACK] Seq=1 Ack=408 Win=65024 Len=0"
"20","43.931788","127.0.0.1","127.0.0.1","HTTP","199","HTTP/1.1 200 OK "
"21","43.931830","127.0.0.1","127.0.0.1","TCP","44","60341  >  60331 [ACK] Seq=408 Ack=156 Win=65280 Len=0"
"22","43.936503","127.0.0.1","127.0.0.1","TCP","56","60342  >  60332 [SYN] Seq=0 Win=65535 Len=0 MSS=65495 WS=256 SACK_PERM"
"23","43.936595","127.0.0.1","127.0.0.1","TCP","56","60332  >  60342 [SYN, ACK] Seq=0 Ack=1 Win=65535 Len=0 MSS=65495 WS=256 SACK_PERM"
"24","43.936632","127.0.0.1","127.0.0.1","TCP","44","60342  >  60332 [ACK] Seq=1 Ack=1 Win=65280 Len=0"
"25","43.937012","127.0.0.1","127.0.0.1","TLSv1.3","283","Client Hello"
"26","43.937036","127.0.0.1","127.0.0.1","TCP","44","60332  >  60342 [ACK] Seq=1 Ack=240 Win=65280 Len=0"
"27","43.939766","127.0.0.1","127.0.0.1","TLSv1.3","1602","Server Hello, Change Cipher Spec, Application Data, Application Data, Application Data, Application Data, Application Data"
"28","43.939823","127.0.0.1","127.0.0.1","TCP","44","60342  >  60332 [ACK] Seq=240 Ack=1559 Win=63744 Len=0"
"29","43.943765","127.0.0.1","127.0.0.1","TLSv1.3","108","Change Cipher Spec, Application Data"
"30","43.943801","127.0.0.1","127.0.0.1","TCP","44","60332  >  60342 [ACK] Seq=1559 Ack=304 Win=65024 Len=0"
"31","43.943908","127.0.0.1","127.0.0.1","TLSv1.3","668","Application Data"
"32","43.943925","127.0.0.1","127.0.0.1","TCP","44","60332  >  60342 [ACK] Seq=1559 Ack=928 Win=64512 Len=0"
"33","43.944833","127.0.0.1","127.0.0.1","TLSv1.3","75","Application Data"
"34","43.944858","127.0.0.1","127.0.0.1","TCP","44","60332  >  60342 [ACK] Seq=1559 Ack=959 Win=64512 Len=0"
"35","43.945125","127.0.0.1","127.0.0.1","TLSv1.3","105","Application Data"
"36","43.945152","127.0.0.1","127.0.0.1","TCP","44","60342  >  60332 [ACK] Seq=959 Ack=1620 Win=63744 Len=0"
"37","43.945220","127.0.0.1","127.0.0.1","TLSv1.3","88","Application Data"
"38","43.945238","127.0.0.1","127.0.0.1","TLSv1.3","75","Application Data"
"39","43.945256","127.0.0.1","127.0.0.1","TCP","44","60332  >  60342 [ACK] Seq=1664 Ack=990 Win=64512 Len=0"
"40","43.945263","127.0.0.1","127.0.0.1","TCP","44","60342  >  60332 [ACK] Seq=990 Ack=1664 Win=63744 Len=0"
"41","43.947071","127.0.0.1","127.0.0.1","TCP","451","60341  >  60331 [PSH, ACK] Seq=408 Ack=156 Win=65280 Len=407 [TCP PDU reassembled in 47]"
"42","43.947071","127.0.0.1","127.0.0.1","TLSv1.3","135","Application Data"
"43","43.947105","127.0.0.1","127.0.0.1","TCP","44","60331  >  60341 [ACK] Seq=156 Ack=815 Win=64512 Len=0"
"44","43.947106","127.0.0.1","127.0.0.1","TCP","44","60342  >  60332 [ACK] Seq=990 Ack=1755 Win=63744 Len=0"
"45","43.947144","127.0.0.1","127.0.0.1","TLSv1.3","98","Application Data"
"46","43.947155","127.0.0.1","127.0.0.1","TCP","44","60342  >  60332 [ACK] Seq=990 Ack=1809 Win=63488 Len=0"
"47","43.947687","127.0.0.1","127.0.0.1","HTTP","6990","POST /exa.extension_server_pb.ExtensionServerService/UpdateCascadeTrajectorySummaries HTTP/1.1  (application/proto)"
"48","43.947715","127.0.0.1","127.0.0.1","TCP","44","60331  >  60341 [ACK] Seq=156 Ack=7761 Win=57600 Len=0"
"49","43.957892","127.0.0.1","127.0.0.1","HTTP","199","HTTP/1.1 200 OK "
"50","43.957931","127.0.0.1","127.0.0.1","TCP","44","60341  >  60331 [ACK] Seq=7761 Ack=311 Win=65024 Len=0"
"51","43.966092","127.0.0.1","127.0.0.1","TCP","452","60341  >  60331 [PSH, ACK] Seq=7761 Ack=311 Win=65024 Len=408 [TCP PDU reassembled in 53]"
"52","43.966124","127.0.0.1","127.0.0.1","TCP","44","60331  >  60341 [ACK] Seq=311 Ack=8169 Win=57344 Len=0"
"53","43.966172","127.0.0.1","127.0.0.1","HTTP","10616","POST /exa.extension_server_pb.ExtensionServerService/UpdateCascadeTrajectorySummaries HTTP/1.1  (application/proto)"
"54","43.966195","127.0.0.1","127.0.0.1","TCP","44","60331  >  60341 [ACK] Seq=311 Ack=18741 Win=46592 Len=0"
"55","43.971215","127.0.0.1","127.0.0.1","TCP","56","60346  >  60340 [SYN] Seq=0 Win=65535 Len=0 MSS=65495 WS=256 SACK_PERM"
"56","43.971308","127.0.0.1","127.0.0.1","TCP","56","60340  >  60346 [SYN, ACK] Seq=0 Ack=1 Win=65535 Len=0 MSS=65495 WS=256 SACK_PERM"
"57","43.971349","127.0.0.1","127.0.0.1","TCP","44","60346  >  60340 [ACK] Seq=1 Ack=1 Win=65280 Len=0"
"58","43.982058","127.0.0.1","127.0.0.1","TLSv1.3","306","Application Data"
"59","43.982098","127.0.0.1","127.0.0.1","TCP","44","60332  >  60342 [ACK] Seq=1809 Ack=1252 Win=64256 Len=0"
"60","43.982809","127.0.0.1","127.0.0.1","TCP","56","60347  >  60332 [SYN] Seq=0 Win=65535 Len=0 MSS=65495 WS=256 SACK_PERM"
"61","43.982893","127.0.0.1","127.0.0.1","TCP","56","60332  >  60347 [SYN, ACK] Seq=0 Ack=1 Win=65535 Len=0 MSS=65495 WS=256 SACK_PERM"
"62","43.982929","127.0.0.1","127.0.0.1","TCP","44","60347  >  60332 [ACK] Seq=1 Ack=1 Win=65280 Len=0"
"63","43.983544","127.0.0.1","127.0.0.1","TLSv1.3","1777","Client Hello"
"64","43.983578","127.0.0.1","127.0.0.1","TCP","44","60332  >  60347 [ACK] Seq=1 Ack=1734 Win=63744 Len=0"
"65","43.984014","127.0.0.1","127.0.0.1","TCP","56","60348  >  60332 [SYN] Seq=0 Win=65535 Len=0 MSS=65495 WS=256 SACK_PERM"
"66","43.984092","127.0.0.1","127.0.0.1","TCP","56","60332  >  60348 [SYN, ACK] Seq=0 Ack=1 Win=65535 Len=0 MSS=65495 WS=256 SACK_PERM"
"67","43.984122","127.0.0.1","127.0.0.1","TCP","44","60348  >  60332 [ACK] Seq=1 Ack=1 Win=65280 Len=0"
"68","43.984509","127.0.0.1","127.0.0.1","TLSv1.3","1841","Client Hello"
"69","43.984531","127.0.0.1","127.0.0.1","TCP","44","60332  >  60348 [ACK] Seq=1 Ack=1798 Win=63488 Len=0"
"70","43.984809","127.0.0.1","127.0.0.1","TCP","56","60349  >  60332 [SYN] Seq=0 Win=65535 Len=0 MSS=65495 WS=256 SACK_PERM"
"71","43.984876","127.0.0.1","127.0.0.1","TCP","56","60332  >  60349 [SYN, ACK] Seq=0 Ack=1 Win=65535 Len=0 MSS=65495 WS=256 SACK_PERM"
"72","43.984905","127.0.0.1","127.0.0.1","TCP","44","60349  >  60332 [ACK] Seq=1 Ack=1 Win=65280 Len=0"
"73","43.985244","127.0.0.1","127.0.0.1","TLSv1.3","1809","Client Hello"
"74","43.985262","127.0.0.1","127.0.0.1","TCP","44","60332  >  60349 [ACK] Seq=1 Ack=1766 Win=63744 Len=0"
"75","43.985851","127.0.0.1","127.0.0.1","HTTP","199","HTTP/1.1 200 OK "
"76","43.985880","127.0.0.1","127.0.0.1","TCP","44","60341  >  60331 [ACK] Seq=18741 Ack=466 Win=65024 Len=0"
"77","43.986047","127.0.0.1","127.0.0.1","TLSv1.3","2690","Server Hello, Change Cipher Spec, Application Data, Application Data, Application Data, Application Data, Application Data"
"78","43.986089","127.0.0.1","127.0.0.1","TCP","44","60347  >  60332 [ACK] Seq=1734 Ack=2647 Win=62720 Len=0"
"79","43.987382","127.0.0.1","127.0.0.1","TLSv1.3","108","Change Cipher Spec, Application Data"
"80","43.987411","127.0.0.1","127.0.0.1","TCP","44","60332  >  60347 [ACK] Seq=2647 Ack=1798 Win=63488 Len=0"
"81","43.987562","127.0.0.1","127.0.0.1","TLSv1.3","136","Application Data"
"82","43.987575","127.0.0.1","127.0.0.1","TCP","44","60332  >  60347 [ACK] Seq=2647 Ack=1890 Win=63488 Len=0"
"83","43.987610","127.0.0.1","127.0.0.1","TCP","44","60348  >  60332 [FIN, ACK] Seq=1798 Ack=1 Win=65280 Len=0"
"84","43.987626","127.0.0.1","127.0.0.1","TCP","44","60332  >  60348 [ACK] Seq=1 Ack=1799 Win=63488 Len=0"
"85","43.987705","127.0.0.1","127.0.0.1","TCP","44","60349  >  60332 [FIN, ACK] Seq=1766 Ack=1 Win=65280 Len=0"
"86","43.987718","127.0.0.1","127.0.0.1","TCP","44","60332  >  60349 [ACK] Seq=1 Ack=1767 Win=63744 Len=0"
"87","43.988059","127.0.0.1","127.0.0.1","TLSv1.3","488","Application Data"
"88","43.988075","127.0.0.1","127.0.0.1","TCP","44","60332  >  60347 [ACK] Seq=2647 Ack=2334 Win=62976 Len=0"
"89","43.988102","127.0.0.1","127.0.0.1","TLSv1.3","148","Application Data"
"90","43.988111","127.0.0.1","127.0.0.1","TCP","44","60332  >  60347 [ACK] Seq=2647 Ack=2438 Win=62976 Len=0"
"91","43.988135","127.0.0.1","127.0.0.1","TLSv1.3","186","Application Data"
"92","43.988143","127.0.0.1","127.0.0.1","TCP","44","60332  >  60347 [ACK] Seq=2647 Ack=2580 Win=62720 Len=0"
"93","43.988279","127.0.0.1","127.0.0.1","TLSv1.3","105","Application Data"
"94","43.988302","127.0.0.1","127.0.0.1","TCP","44","60347  >  60332 [ACK] Seq=2580 Ack=2708 Win=62720 Len=0"
"95","43.988324","127.0.0.1","127.0.0.1","TLSv1.3","88","Application Data"
"96","43.988333","127.0.0.1","127.0.0.1","TCP","44","60347  >  60332 [ACK] Seq=2580 Ack=2752 Win=62720 Len=0"
"97","43.988378","127.0.0.1","127.0.0.1","TLSv1.3","75","Application Data"
"98","43.988398","127.0.0.1","127.0.0.1","TLSv1.3","294","Application Data"
"99","43.988415","127.0.0.1","127.0.0.1","TCP","44","60347  >  60332 [ACK] Seq=2611 Ack=3002 Win=62464 Len=0"
"100","43.988457","127.0.0.1","127.0.0.1","TLSv1.3","82","Application Data"
"101","43.988476","127.0.0.1","127.0.0.1","TCP","44","60347  >  60332 [ACK] Seq=2611 Ack=3040 Win=62464 Len=0"
"102","43.988513","127.0.0.1","127.0.0.1","TLSv1.3","138","Application Data"
"103","43.988523","127.0.0.1","127.0.0.1","TCP","44","60347  >  60332 [ACK] Seq=2611 Ack=3134 Win=62208 Len=0"
"104","43.990512","127.0.0.1","127.0.0.1","TLSv1.3","311","Application Data"
"105","43.990546","127.0.0.1","127.0.0.1","TCP","44","60332  >  60347 [ACK] Seq=3134 Ack=2878 Win=62464 Len=0"
"106","43.990579","127.0.0.1","127.0.0.1","TLSv1.3","77","Application Data"
"107","43.990593","127.0.0.1","127.0.0.1","TCP","44","60332  >  60347 [ACK] Seq=3134 Ack=2911 Win=62464 Len=0"
"108","43.990713","127.0.0.1","127.0.0.1","TLSv1.3","2690","Server Hello, Change Cipher Spec, Application Data, Application Data, Application Data, Application Data, Application Data"
"109","43.990787","127.0.0.1","127.0.0.1","TCP","44","60348  >  60332 [RST, ACK] Seq=1799 Ack=2647 Win=0 Len=0"
"110","43.990868","127.0.0.1","127.0.0.1","TLSv1.3","149","Application Data"
"111","43.990884","127.0.0.1","127.0.0.1","TCP","44","60332  >  60347 [ACK] Seq=3134 Ack=3016 Win=62464 Len=0"
"112","43.990933","127.0.0.1","127.0.0.1","TLSv1.3","282","Application Data"
"113","43.990946","127.0.0.1","127.0.0.1","TCP","44","60332  >  60347 [ACK] Seq=3134 Ack=3254 Win=62208 Len=0"
"114","43.990974","127.0.0.1","127.0.0.1","TLSv1.3","451","Application Data"
"115","43.990985","127.0.0.1","127.0.0.1","TCP","44","60332  >  60347 [ACK] Seq=3134 Ack=3661 Win=61696 Len=0"
"116","43.991006","127.0.0.1","127.0.0.1","TLSv1.3","607","Application Data"
"117","43.991018","127.0.0.1","127.0.0.1","TCP","44","60332  >  60347 [ACK] Seq=3134 Ack=4224 Win=61184 Len=0"
"118","43.991062","127.0.0.1","127.0.0.1","TLSv1.3","2690","Server Hello, Change Cipher Spec, Application Data, Application Data, Application Data, Application Data, Application Data"
"119","43.991113","127.0.0.1","127.0.0.1","TCP","44","60349  >  60332 [RST, ACK] Seq=1767 Ack=2647 Win=0 Len=0"
"120","43.992304","127.0.0.1","127.0.0.1","TLSv1.3","147","Application Data"
"121","43.992335","127.0.0.1","127.0.0.1","TCP","44","60347  >  60332 [ACK] Seq=4224 Ack=3237 Win=62208 Len=0"
"122","43.993814","127.0.0.1","127.0.0.1","TLSv1.3","617","Application Data"
"123","43.993856","127.0.0.1","127.0.0.1","TCP","44","60347  >  60332 [ACK] Seq=4224 Ack=3810 Win=61696 Len=0"
"124","43.999233","127.0.0.1","127.0.0.1","TLSv1.3","84","Application Data"
"125","43.999273","127.0.0.1","127.0.0.1","TCP","44","60347  >  60332 [ACK] Seq=4224 Ack=3850 Win=61440 Len=0"
"126","43.999376","127.0.0.1","127.0.0.1","TLSv1.3","5831","Application Data"
"127","43.999443","127.0.0.1","127.0.0.1","TCP","44","60347  >  60332 [ACK] Seq=4224 Ack=9637 Win=55808 Len=0"
"128","43.999515","127.0.0.1","127.0.0.1","TLSv1.3","75","Application Data"
"129","43.999534","127.0.0.1","127.0.0.1","TCP","44","60347  >  60332 [ACK] Seq=4224 Ack=9668 Win=55808 Len=0"
"130","43.999845","127.0.0.1","127.0.0.1","TCP","56","60350  >  60333 [SYN] Seq=0 Win=65535 Len=0 MSS=65495 WS=256 SACK_PERM"
"131","43.999950","127.0.0.1","127.0.0.1","TCP","56","60333  >  60350 [SYN, ACK] Seq=0 Ack=1 Win=65535 Len=0 MSS=65495 WS=256 SACK_PERM"
"132","43.999998","127.0.0.1","127.0.0.1","TCP","44","60350  >  60333 [ACK] Seq=1 Ack=1 Win=65280 Len=0"
"133","44.000424","127.0.0.1","127.0.0.1","TCP","56","60351  >  60333 [SYN] Seq=0 Win=65535 Len=0 MSS=65495 WS=256 SACK_PERM"
"134","44.000510","127.0.0.1","127.0.0.1","TCP","56","60333  >  60351 [SYN, ACK] Seq=0 Ack=1 Win=65535 Len=0 MSS=65495 WS=256 SACK_PERM"
"135","44.000543","127.0.0.1","127.0.0.1","TCP","44","60351  >  60333 [ACK] Seq=1 Ack=1 Win=65280 Len=0"
"136","44.000760","127.0.0.1","127.0.0.1","TLSv1.3","75","Application Data"
"137","44.000797","127.0.0.1","127.0.0.1","TCP","44","60332  >  60342 [ACK] Seq=1809 Ack=1283 Win=64000 Len=0"
"138","44.001578","127.0.0.1","127.0.0.1","TCP","68","60346  >  60340 [PSH, ACK] Seq=1 Ack=1 Win=65280 Len=24"
"139","44.001607","127.0.0.1","127.0.0.1","TCP","44","60340  >  60346 [ACK] Seq=1 Ack=25 Win=65280 Len=0"
"140","44.001725","127.0.0.1","127.0.0.1","TCP","5967","60346  >  60340 [PSH, ACK] Seq=25 Ack=1 Win=65280 Len=5923"
"141","44.001755","127.0.0.1","127.0.0.1","TCP","44","60340  >  60346 [ACK] Seq=1 Ack=5948 Win=59392 Len=0"
"142","44.003647","127.0.0.1","127.0.0.1","TLSv1.3","109","Application Data"
"143","44.003685","127.0.0.1","127.0.0.1","TCP","44","60342  >  60332 [ACK] Seq=1283 Ack=1874 Win=63488 Len=0"
"144","44.003764","127.0.0.1","127.0.0.1","TLSv1.3","113","Application Data"
"145","44.003779","127.0.0.1","127.0.0.1","TCP","44","60342  >  60332 [ACK] Seq=1283 Ack=1943 Win=63488 Len=0"
"146","44.005367","127.0.0.1","127.0.0.1","TCP","67","60340  >  60346 [PSH, ACK] Seq=1 Ack=5948 Win=59392 Len=23"
"147","44.005398","127.0.0.1","127.0.0.1","TCP","44","60346  >  60340 [ACK] Seq=5948 Ack=24 Win=65280 Len=0"
"148","44.005415","127.0.0.1","127.0.0.1","TCP","255","60340  >  60346 [PSH, ACK] Seq=24 Ack=5948 Win=59392 Len=211"
"149","44.005424","127.0.0.1","127.0.0.1","TCP","44","60346  >  60340 [ACK] Seq=5948 Ack=235 Win=65280 Len=0"
"150","44.006555","127.0.0.1","127.0.0.1","HTTP","524","GET /proxy/unleash/client/features HTTP/1.1 "
"151","44.006596","127.0.0.1","127.0.0.1","TCP","44","60333  >  60350 [ACK] Seq=1 Ack=481 Win=65024 Len=0"
"152","44.006765","127.0.0.1","127.0.0.1","HTTP/JSON","1030","POST /proxy/unleash/client/register HTTP/1.1 , JSON (application/json)"
"153","44.006791","127.0.0.1","127.0.0.1","TCP","44","60333  >  60351 [ACK] Seq=1 Ack=987 Win=64512 Len=0"
"154","44.036426","127.0.0.1","127.0.0.1","TCP","66","60346  >  60340 [PSH, ACK] Seq=5948 Ack=235 Win=65280 Len=22"
"155","44.036470","127.0.0.1","127.0.0.1","TCP","44","60340  >  60346 [ACK] Seq=235 Ack=5970 Win=59392 Len=0"
"156","44.036538","127.0.0.1","127.0.0.1","TCP","96","60346  >  60340 [PSH, ACK] Seq=5970 Ack=235 Win=65280 Len=52"
"157","44.036557","127.0.0.1","127.0.0.1","TCP","44","60340  >  60346 [ACK] Seq=235 Ack=6022 Win=59392 Len=0"
"158","44.041621","127.0.0.1","127.0.0.1","TCP","68","60346  >  60340 [PSH, ACK] Seq=6022 Ack=235 Win=65280 Len=24"
"159","44.041663","127.0.0.1","127.0.0.1","TCP","44","60340  >  60346 [ACK] Seq=235 Ack=6046 Win=59392 Len=0"
"160","44.041739","127.0.0.1","127.0.0.1","TCP","9014","60346  >  60340 [PSH, ACK] Seq=6046 Ack=235 Win=65280 Len=8970"
"161","44.041776","127.0.0.1","127.0.0.1","TCP","44","60340  >  60346 [ACK] Seq=235 Ack=15016 Win=50432 Len=0"
"162","44.041875","127.0.0.1","127.0.0.1","TCP","67","60346  >  60340 [PSH, ACK] Seq=15016 Ack=235 Win=65280 Len=23"
"163","44.041889","127.0.0.1","127.0.0.1","TCP","44","60340  >  60346 [ACK] Seq=235 Ack=15039 Win=50432 Len=0"
"164","44.041925","127.0.0.1","127.0.0.1","TCP","315","60346  >  60340 [PSH, ACK] Seq=15039 Ack=235 Win=65280 Len=271"
"165","44.041938","127.0.0.1","127.0.0.1","TCP","44","60340  >  60346 [ACK] Seq=235 Ack=15310 Win=50176 Len=0"
"166","44.042123","127.0.0.1","127.0.0.1","TCP","68","60346  >  60340 [PSH, ACK] Seq=15310 Ack=235 Win=65280 Len=24"
"167","44.042136","127.0.0.1","127.0.0.1","TCP","44","60340  >  60346 [ACK] Seq=235 Ack=15334 Win=50176 Len=0"
"168","44.042228","127.0.0.1","127.0.0.1","TCP","8770","60346  >  60340 [PSH, ACK] Seq=15334 Ack=235 Win=65280 Len=8726"
"169","44.042259","127.0.0.1","127.0.0.1","TCP","44","60340  >  60346 [ACK] Seq=235 Ack=24060 Win=41472 Len=0"
"170","44.264623","127.0.0.1","127.0.0.1","TLSv1.3","259","Application Data"
"171","44.264662","127.0.0.1","127.0.0.1","TCP","44","60347  >  60332 [ACK] Seq=4224 Ack=9883 Win=55552 Len=0"
"172","44.264729","127.0.0.1","127.0.0.1","TLSv1.3","10407","Application Data"
"173","44.264751","127.0.0.1","127.0.0.1","TCP","44","60347  >  60332 [ACK] Seq=4224 Ack=20246 Win=45056 Len=0"
"174","44.264803","127.0.0.1","127.0.0.1","TLSv1.3","75","Application Data"
"175","44.264815","127.0.0.1","127.0.0.1","TCP","44","60347  >  60332 [ACK] Seq=4224 Ack=20277 Win=45056 Len=0"
"176","44.269593","127.0.0.1","127.0.0.1","QUIC","1282","Initial, DCID=0e2c7b2f130b7d4f, PKN: 1, PING, PING, CRYPTO, PADDING, CRYPTO, CRYPTO, PADDING, PING, CRYPTO, PADDING, PING, CRYPTO, PING, PADDING, PING, PADDING, CRYPTO, PING, PADDING, PING, PADDING"
"177","44.269625","127.0.0.1","127.0.0.1","ICMP","580","Destination unreachable (Port unreachable)"
"178","44.269672","127.0.0.1","127.0.0.1","QUIC","1282","Initial, DCID=0e2c7b2f130b7d4f, PKN: 2, CRYPTO, PING, CRYPTO, PING, CRYPTO, CRYPTO, PADDING, CRYPTO, PING, PADDING, PING, PADDING, PING, CRYPTO, CRYPTO, CRYPTO, PADDING, CRYPTO, CRYPTO, PING, CRYPTO"
"179","44.269685","127.0.0.1","127.0.0.1","ICMP","580","Destination unreachable (Port unreachable)"
"180","44.270120","127.0.0.1","127.0.0.1","TLSv1.3","122","Application Data"
"181","44.270144","127.0.0.1","127.0.0.1","TCP","44","60332  >  60347 [ACK] Seq=20277 Ack=4302 Win=61184 Len=0"
"182","44.270315","127.0.0.1","127.0.0.1","TLSv1.3","82","Application Data"
"183","44.270328","127.0.0.1","127.0.0.1","TCP","44","60347  >  60332 [ACK] Seq=4302 Ack=20315 Win=45056 Len=0"
"184","44.271308","127.0.0.1","127.0.0.1","TLSv1.3","125","Application Data"
"185","44.271326","127.0.0.1","127.0.0.1","TCP","44","60332  >  60347 [ACK] Seq=20315 Ack=4383 Win=60928 Len=0"
"186","44.271346","127.0.0.1","127.0.0.1","TLSv1.3","694","Application Data"
"187","44.271359","127.0.0.1","127.0.0.1","TCP","44","60332  >  60347 [ACK] Seq=20315 Ack=5033 Win=60416 Len=0"
"188","44.279453","127.0.0.1","127.0.0.1","TCP","1100","60333  >  60350 [PSH, ACK] Seq=1 Ack=481 Win=65024 Len=1056 [TCP PDU reassembled in 206]"
"189","44.279486","127.0.0.1","127.0.0.1","TCP","44","60350  >  60333 [ACK] Seq=481 Ack=1057 Win=64256 Len=0"
"190","44.279540","127.0.0.1","127.0.0.1","TCP","4140","60333  >  60350 [PSH, ACK] Seq=1057 Ack=481 Win=65024 Len=4096 [TCP PDU reassembled in 206]"
"191","44.279558","127.0.0.1","127.0.0.1","TCP","44","60350  >  60333 [ACK] Seq=481 Ack=5153 Win=60160 Len=0"
"192","44.279574","127.0.0.1","127.0.0.1","TCP","9316","60333  >  60350 [PSH, ACK] Seq=5153 Ack=481 Win=65024 Len=9272 [TCP PDU reassembled in 206]"
"193","44.279595","127.0.0.1","127.0.0.1","TCP","44","60350  >  60333 [ACK] Seq=481 Ack=14425 Win=50944 Len=0"
"194","44.376138","127.0.0.1","127.0.0.1","TCP","4140","60333  >  60350 [PSH, ACK] Seq=14425 Ack=481 Win=65024 Len=4096 [TCP PDU reassembled in 206]"
"195","44.376188","127.0.0.1","127.0.0.1","TCP","44","60350  >  60333 [ACK] Seq=481 Ack=18521 Win=46848 Len=0"
"196","44.376210","127.0.0.1","127.0.0.1","TCP","8448","60333  >  60350 [PSH, ACK] Seq=18521 Ack=481 Win=65024 Len=8404 [TCP PDU reassembled in 206]"
"197","44.376229","127.0.0.1","127.0.0.1","TCP","44","60350  >  60333 [ACK] Seq=481 Ack=26925 Win=38400 Len=0"
"198","44.408549","127.0.0.1","127.0.0.1","TCP","4140","60333  >  60350 [PSH, ACK] Seq=26925 Ack=481 Win=65024 Len=4096 [TCP PDU reassembled in 206]"
"199","44.408590","127.0.0.1","127.0.0.1","TCP","44","60350  >  60333 [ACK] Seq=481 Ack=31021 Win=34304 Len=0"
"200","44.408615","127.0.0.1","127.0.0.1","TCP","11216","60333  >  60350 [PSH, ACK] Seq=31021 Ack=481 Win=65024 Len=11172 [TCP PDU reassembled in 206]"
"201","44.408636","127.0.0.1","127.0.0.1","TCP","44","60350  >  60333 [ACK] Seq=481 Ack=42193 Win=65280 Len=0"
"202","44.421946","127.0.0.1","127.0.0.1","TCP","4140","60333  >  60350 [PSH, ACK] Seq=42193 Ack=481 Win=65024 Len=4096 [TCP PDU reassembled in 206]"
"203","44.421985","127.0.0.1","127.0.0.1","TCP","44","60350  >  60333 [ACK] Seq=481 Ack=46289 Win=61184 Len=0"
"204","44.422003","127.0.0.1","127.0.0.1","TCP","4495","60333  >  60350 [PSH, ACK] Seq=46289 Ack=481 Win=65024 Len=4451 [TCP PDU reassembled in 206]"
"205","44.422025","127.0.0.1","127.0.0.1","TCP","44","60350  >  60333 [ACK] Seq=481 Ack=50740 Win=56832 Len=0"
"206","44.422050","127.0.0.1","127.0.0.1","HTTP/JSON","51","HTTP/1.1 200 OK , JSON (application/json)"
"207","44.422060","127.0.0.1","127.0.0.1","TCP","44","60350  >  60333 [ACK] Seq=481 Ack=50747 Win=56832 Len=0"
"208","44.422151","127.0.0.1","127.0.0.1","TCP","44","60333  >  60350 [FIN, ACK] Seq=50747 Ack=481 Win=65024 Len=0"
"209","44.422172","127.0.0.1","127.0.0.1","TCP","44","60350  >  60333 [ACK] Seq=481 Ack=50748 Win=56832 Len=0"
"210","44.441866","127.0.0.1","127.0.0.1","TCP","44","60350  >  60333 [FIN, ACK] Seq=481 Ack=50748 Win=56832 Len=0"
"211","44.441945","127.0.0.1","127.0.0.1","TCP","44","60333  >  60350 [ACK] Seq=50748 Ack=482 Win=65024 Len=0"
"212","44.451710","127.0.0.1","127.0.0.1","TLSv1.3","990","Application Data"
"213","44.451750","127.0.0.1","127.0.0.1","TCP","44","60332  >  60342 [ACK] Seq=1943 Ack=2229 Win=63232 Len=0"
"214","44.452185","127.0.0.1","127.0.0.1","TLSv1.3","84","Application Data"
"215","44.452212","127.0.0.1","127.0.0.1","TCP","44","60332  >  60342 [ACK] Seq=1943 Ack=2269 Win=63232 Len=0"
"216","44.452523","127.0.0.1","127.0.0.1","TLSv1.3","82","Application Data"
"217","44.452546","127.0.0.1","127.0.0.1","TCP","44","60342  >  60332 [ACK] Seq=2269 Ack=1981 Win=63488 Len=0"
"218","44.452575","127.0.0.1","127.0.0.1","TLSv1.3","98","Application Data"
"219","44.452586","127.0.0.1","127.0.0.1","TCP","44","60342  >  60332 [ACK] Seq=2269 Ack=2035 Win=63488 Len=0"
"220","44.452869","127.0.0.1","127.0.0.1","TLSv1.3","82","Application Data"
"221","44.452887","127.0.0.1","127.0.0.1","TCP","44","60342  >  60332 [ACK] Seq=2269 Ack=2073 Win=63232 Len=0"
"222","44.452913","127.0.0.1","127.0.0.1","TLSv1.3","98","Application Data"
"223","44.452923","127.0.0.1","127.0.0.1","TCP","44","60342  >  60332 [ACK] Seq=2269 Ack=2127 Win=63232 Len=0"
"224","44.455398","127.0.0.1","127.0.0.1","TLSv1.3","569","Application Data"
"225","44.455431","127.0.0.1","127.0.0.1","TCP","44","60332  >  60342 [ACK] Seq=2127 Ack=2794 Win=62720 Len=0"
"226","44.455994","127.0.0.1","127.0.0.1","TLSv1.3","75","Application Data"
"227","44.456018","127.0.0.1","127.0.0.1","TCP","44","60332  >  60342 [ACK] Seq=2127 Ack=2825 Win=62464 Len=0"
"228","44.458387","127.0.0.1","127.0.0.1","HTTP","487","HTTP/1.1 202 Accepted "
"229","44.458417","127.0.0.1","127.0.0.1","TCP","44","60351  >  60333 [ACK] Seq=987 Ack=444 Win=65024 Len=0"
"230","44.458463","127.0.0.1","127.0.0.1","TCP","44","60333  >  60351 [FIN, ACK] Seq=444 Ack=987 Win=64512 Len=0"
"231","44.458490","127.0.0.1","127.0.0.1","TCP","44","60351  >  60333 [ACK] Seq=987 Ack=445 Win=65024 Len=0"
"232","44.459495","127.0.0.1","127.0.0.1","TCP","44","60351  >  60333 [FIN, ACK] Seq=987 Ack=445 Win=65024 Len=0"
"233","44.459549","127.0.0.1","127.0.0.1","TCP","44","60333  >  60351 [ACK] Seq=445 Ack=988 Win=64512 Len=0"
"234","44.459720","127.0.0.1","127.0.0.1","TLSv1.3","569","Application Data"
"235","44.459751","127.0.0.1","127.0.0.1","TCP","44","60332  >  60342 [ACK] Seq=2127 Ack=3350 Win=61952 Len=0"
"236","44.460024","127.0.0.1","127.0.0.1","TLSv1.3","75","Application Data"
"237","44.460049","127.0.0.1","127.0.0.1","TCP","44","60332  >  60342 [ACK] Seq=2127 Ack=3381 Win=61952 Len=0"
"238","44.464206","127.0.0.1","127.0.0.1","TLSv1.3","528","Application Data"
"239","44.464241","127.0.0.1","127.0.0.1","TCP","44","60332  >  60342 [ACK] Seq=2127 Ack=3865 Win=61440 Len=0"
"240","44.464372","127.0.0.1","127.0.0.1","TLSv1.3","75","Application Data"
"241","44.464384","127.0.0.1","127.0.0.1","TCP","44","60332  >  60342 [ACK] Seq=2127 Ack=3896 Win=61440 Len=0"
"242","44.464520","127.0.0.1","127.0.0.1","TLSv1.3","82","Application Data"
"243","44.464541","127.0.0.1","127.0.0.1","TCP","44","60342  >  60332 [ACK] Seq=3896 Ack=2165 Win=63232 Len=0"
"244","44.464560","127.0.0.1","127.0.0.1","TLSv1.3","98","Application Data"
"245","44.464568","127.0.0.1","127.0.0.1","TCP","44","60342  >  60332 [ACK] Seq=3896 Ack=2219 Win=63232 Len=0"
"246","44.466428","127.0.0.1","127.0.0.1","TLSv1.3","569","Application Data"
"247","44.466462","127.0.0.1","127.0.0.1","TCP","44","60332  >  60342 [ACK] Seq=2219 Ack=4421 Win=60928 Len=0"
"248","44.467135","127.0.0.1","127.0.0.1","TLSv1.3","75","Application Data"
"249","44.467159","127.0.0.1","127.0.0.1","TCP","44","60332  >  60342 [ACK] Seq=2219 Ack=4452 Win=60928 Len=0"
"250","44.700980","127.0.0.1","127.0.0.1","TLSv1.3","566","Application Data"
"251","44.701015","127.0.0.1","127.0.0.1","TCP","44","60332  >  60342 [ACK] Seq=2219 Ack=4974 Win=60416 Len=0"
"252","44.702940","127.0.0.1","127.0.0.1","TLSv1.3","75","Application Data"
"253","44.702969","127.0.0.1","127.0.0.1","TCP","44","60332  >  60342 [ACK] Seq=2219 Ack=5005 Win=60416 Len=0"
"254","44.703658","127.0.0.1","127.0.0.1","TLSv1.3","85","Application Data"
"255","44.703687","127.0.0.1","127.0.0.1","TCP","44","60342  >  60332 [ACK] Seq=5005 Ack=2260 Win=63232 Len=0"
"256","44.703744","127.0.0.1","127.0.0.1","TLSv1.3","114","Application Data"
"257","44.703759","127.0.0.1","127.0.0.1","TCP","44","60342  >  60332 [ACK] Seq=5005 Ack=2330 Win=62976 Len=0"
"258","44.874409","127.0.0.1","127.0.0.1","TLSv1.3","88","Application Data"
"259","44.874437","127.0.0.1","127.0.0.1","TCP","44","60347  >  60332 [ACK] Seq=5033 Ack=20359 Win=45056 Len=0"
"260","44.874517","127.0.0.1","127.0.0.1","TLSv1.3","14102","Application Data"
"261","44.874543","127.0.0.1","127.0.0.1","TCP","44","60347  >  60332 [ACK] Seq=5033 Ack=34417 Win=65280 Len=0"
"262","44.874595","127.0.0.1","127.0.0.1","TLSv1.3","75","Application Data"
"263","44.874606","127.0.0.1","127.0.0.1","TCP","44","60347  >  60332 [ACK] Seq=5033 Ack=34448 Win=65280 Len=0"
"264","44.964330","127.0.0.1","127.0.0.1","TLSv1.3","151","Application Data"
"265","44.964368","127.0.0.1","127.0.0.1","TCP","44","60332  >  60342 [ACK] Seq=2330 Ack=5112 Win=60416 Len=0"
"266","44.964609","127.0.0.1","127.0.0.1","TLSv1.3","75","Application Data"
"267","44.964633","127.0.0.1","127.0.0.1","TCP","44","60332  >  60342 [ACK] Seq=2330 Ack=5143 Win=60160 Len=0"
"268","44.999656","127.0.0.1","127.0.0.1","TLSv1.3","106","Application Data"
"269","44.999705","127.0.0.1","127.0.0.1","TCP","44","60342  >  60332 [ACK] Seq=5143 Ack=2392 Win=62976 Len=0"
"270","44.999784","127.0.0.1","127.0.0.1","TLSv1.3","98","Application Data"
"271","44.999797","127.0.0.1","127.0.0.1","TCP","44","60342  >  60332 [ACK] Seq=5143 Ack=2446 Win=62976 Len=0"
"272","45.708097","127.0.0.1","127.0.0.1","TLSv1.3","566","Application Data"
"273","45.708145","127.0.0.1","127.0.0.1","TCP","44","60332  >  60342 [ACK] Seq=2446 Ack=5665 Win=59648 Len=0"
"274","45.708293","127.0.0.1","127.0.0.1","TLSv1.3","75","Application Data"
"275","45.708326","127.0.0.1","127.0.0.1","TCP","44","60332  >  60342 [ACK] Seq=2446 Ack=5696 Win=59648 Len=0"
"276","45.708547","127.0.0.1","127.0.0.1","TLSv1.3","82","Application Data"
"277","45.708569","127.0.0.1","127.0.0.1","TCP","44","60342  >  60332 [ACK] Seq=5696 Ack=2484 Win=62976 Len=0"
"278","45.708601","127.0.0.1","127.0.0.1","TLSv1.3","114","Application Data"
"279","45.708613","127.0.0.1","127.0.0.1","TCP","44","60342  >  60332 [ACK] Seq=5696 Ack=2554 Win=62976 Len=0"
"280","46.721643","127.0.0.1","127.0.0.1","TLSv1.3","566","Application Data"
"281","46.721692","127.0.0.1","127.0.0.1","TCP","44","60332  >  60342 [ACK] Seq=2554 Ack=6218 Win=59136 Len=0"
"282","46.721950","127.0.0.1","127.0.0.1","TLSv1.3","75","Application Data"
"283","46.721971","127.0.0.1","127.0.0.1","TLSv1.3","79","Application Data"
"284","46.721982","127.0.0.1","127.0.0.1","TCP","44","60342  >  60332 [ACK] Seq=6249 Ack=2589 Win=62720 Len=0"
"285","46.722195","127.0.0.1","127.0.0.1","TLSv1.3","106","Application Data"
"286","46.722211","127.0.0.1","127.0.0.1","TCP","44","60342  >  60332 [ACK] Seq=6249 Ack=2651 Win=62720 Len=0"
"287","46.722274","127.0.0.1","127.0.0.1","TLSv1.3","114","Application Data"
"288","46.722295","127.0.0.1","127.0.0.1","TCP","44","60342  >  60332 [ACK] Seq=6249 Ack=2721 Win=62720 Len=0"
"289","47.735992","127.0.0.1","127.0.0.1","TLSv1.3","566","Application Data"
"290","47.736024","127.0.0.1","127.0.0.1","TCP","44","60332  >  60342 [ACK] Seq=2721 Ack=6771 Win=58624 Len=0"
"291","47.736180","127.0.0.1","127.0.0.1","TLSv1.3","75","Application Data"
"292","47.736196","127.0.0.1","127.0.0.1","TCP","44","60332  >  60342 [ACK] Seq=2721 Ack=6802 Win=58624 Len=0"
"293","47.736710","127.0.0.1","127.0.0.1","TLSv1.3","106","Application Data"
"294","47.736730","127.0.0.1","127.0.0.1","TCP","44","60342  >  60332 [ACK] Seq=6802 Ack=2783 Win=62720 Len=0"
"295","47.736760","127.0.0.1","127.0.0.1","TLSv1.3","114","Application Data"
"296","47.736771","127.0.0.1","127.0.0.1","TCP","44","60342  >  60332 [ACK] Seq=6802 Ack=2853 Win=62464 Len=0"
"297","48.744736","127.0.0.1","127.0.0.1","TLSv1.3","566","Application Data"
"298","48.744770","127.0.0.1","127.0.0.1","TCP","44","60332  >  60342 [ACK] Seq=2853 Ack=7324 Win=58112 Len=0"
"299","48.744909","127.0.0.1","127.0.0.1","TLSv1.3","75","Application Data"
"300","48.744924","127.0.0.1","127.0.0.1","TCP","44","60332  >  60342 [ACK] Seq=2853 Ack=7355 Win=58112 Len=0"
"301","48.745103","127.0.0.1","127.0.0.1","TLSv1.3","106","Application Data"
"302","48.745120","127.0.0.1","127.0.0.1","TCP","44","60342  >  60332 [ACK] Seq=7355 Ack=2915 Win=62464 Len=0"
"303","48.745149","127.0.0.1","127.0.0.1","TLSv1.3","114","Application Data"
"304","48.745160","127.0.0.1","127.0.0.1","TCP","44","60342  >  60332 [ACK] Seq=7355 Ack=2985 Win=62464 Len=0"
"305","49.754989","127.0.0.1","127.0.0.1","TLSv1.3","566","Application Data"
"306","49.755021","127.0.0.1","127.0.0.1","TCP","44","60332  >  60342 [ACK] Seq=2985 Ack=7877 Win=57600 Len=0"
"307","49.755163","127.0.0.1","127.0.0.1","TLSv1.3","75","Application Data"
"308","49.755186","127.0.0.1","127.0.0.1","TCP","44","60332  >  60342 [ACK] Seq=2985 Ack=7908 Win=57600 Len=0"
"309","49.755480","127.0.0.1","127.0.0.1","TLSv1.3","106","Application Data"
"310","49.755513","127.0.0.1","127.0.0.1","TCP","44","60342  >  60332 [ACK] Seq=7908 Ack=3047 Win=62464 Len=0"
"311","49.755554","127.0.0.1","127.0.0.1","TLSv1.3","114","Application Data"
"312","49.755568","127.0.0.1","127.0.0.1","TCP","44","60342  >  60332 [ACK] Seq=7908 Ack=3117 Win=62208 Len=0"
"313","49.989399","127.0.0.1","127.0.0.1","TCP","44","60331  >  60341 [FIN, ACK] Seq=466 Ack=18741 Win=46592 Len=0"
"314","49.989433","127.0.0.1","127.0.0.1","TCP","44","60341  >  60331 [ACK] Seq=18741 Ack=467 Win=65024 Len=0"
"315","49.989470","127.0.0.1","127.0.0.1","TCP","44","60341  >  60331 [FIN, ACK] Seq=18741 Ack=467 Win=65024 Len=0"
"316","49.989488","127.0.0.1","127.0.0.1","TCP","44","60331  >  60341 [ACK] Seq=467 Ack=18742 Win=46592 Len=0"
"317","50.004481","127.0.0.1","127.0.0.1","TCP","53","61509  >  61499 [PSH, ACK] Seq=19 Ack=7 Win=228 Len=9"
"318","50.004512","127.0.0.1","127.0.0.1","TCP","44","61499  >  61509 [ACK] Seq=7 Ack=28 Win=250 Len=0"
"319","50.005315","127.0.0.1","127.0.0.1","TCP","47","61499  >  61509 [PSH, ACK] Seq=7 Ack=28 Win=250 Len=3"
"320","50.005336","127.0.0.1","127.0.0.1","TCP","44","61509  >  61499 [ACK] Seq=28 Ack=10 Win=228 Len=0"
"321","50.182973","127.0.0.1","127.0.0.1","TCP","69","60346  >  60340 [PSH, ACK] Seq=24060 Ack=235 Win=65280 Len=25"
"322","50.183017","127.0.0.1","127.0.0.1","TCP","44","60340  >  60346 [ACK] Seq=235 Ack=24085 Win=41216 Len=0"
"323","50.183106","127.0.0.1","127.0.0.1","TCP","10581","60346  >  60340 [PSH, ACK] Seq=24085 Ack=235 Win=65280 Len=10537"
"324","50.183144","127.0.0.1","127.0.0.1","TCP","44","60340  >  60346 [ACK] Seq=235 Ack=34622 Win=65280 Len=0"
"325","50.205985","127.0.0.1","127.0.0.1","TCP","67","60346  >  60340 [PSH, ACK] Seq=34622 Ack=235 Win=65280 Len=23"
"326","50.206031","127.0.0.1","127.0.0.1","TCP","44","60340  >  60346 [ACK] Seq=235 Ack=34645 Win=65280 Len=0"
"327","50.206119","127.0.0.1","127.0.0.1","TCP","408","60346  >  60340 [PSH, ACK] Seq=34645 Ack=235 Win=65280 Len=364"
"328","50.206143","127.0.0.1","127.0.0.1","TCP","44","60340  >  60346 [ACK] Seq=235 Ack=35009 Win=65024 Len=0"
"329","50.464285","127.0.0.1","127.0.0.1","TLSv1.3","110","Application Data"
"330","50.464324","127.0.0.1","127.0.0.1","TCP","44","60342  >  60332 [ACK] Seq=7908 Ack=3183 Win=62208 Len=0"
"331","50.464536","127.0.0.1","127.0.0.1","TLSv1.3","86","Application Data"
"332","50.464550","127.0.0.1","127.0.0.1","TCP","44","60342  >  60332 [ACK] Seq=7908 Ack=3225 Win=62208 Len=0"
"333","50.464690","127.0.0.1","127.0.0.1","TLSv1.3","82","Application Data"
"334","50.464703","127.0.0.1","127.0.0.1","TCP","44","60342  >  60332 [ACK] Seq=7908 Ack=3263 Win=62208 Len=0"
"335","50.464739","127.0.0.1","127.0.0.1","TLSv1.3","431","Application Data"
"336","50.464751","127.0.0.1","127.0.0.1","TCP","44","60342  >  60332 [ACK] Seq=7908 Ack=3650 Win=61696 Len=0"
"337","50.464780","127.0.0.1","127.0.0.1","TLSv1.3","429","Application Data"
"338","50.464791","127.0.0.1","127.0.0.1","TCP","44","60342  >  60332 [ACK] Seq=7908 Ack=4035 Win=61440 Len=0"
"339","50.464813","127.0.0.1","127.0.0.1","TLSv1.3","431","Application Data"
"340","50.464827","127.0.0.1","127.0.0.1","TCP","44","60342  >  60332 [ACK] Seq=7908 Ack=4422 Win=60928 Len=0"
"341","50.841711","127.0.0.1","127.0.0.1","TLSv1.3","566","Application Data"
"342","50.841755","127.0.0.1","127.0.0.1","TCP","44","60332  >  60342 [ACK] Seq=4422 Ack=8430 Win=57088 Len=0"
"343","50.855530","127.0.0.1","127.0.0.1","TLSv1.3","1575","Application Data"
"344","50.855574","127.0.0.1","127.0.0.1","TCP","44","60332  >  60342 [ACK] Seq=4422 Ack=9961 Win=55552 Len=0"
"345","50.855808","127.0.0.1","127.0.0.1","TCP","67","60346  >  60340 [PSH, ACK] Seq=35009 Ack=235 Win=65280 Len=23"
"346","50.855829","127.0.0.1","127.0.0.1","TCP","44","60340  >  60346 [ACK] Seq=235 Ack=35032 Win=65024 Len=0"
"347","50.855872","127.0.0.1","127.0.0.1","TCP","526","60346  >  60340 [PSH, ACK] Seq=35032 Ack=235 Win=65280 Len=482"
"348","50.855894","127.0.0.1","127.0.0.1","TCP","44","60340  >  60346 [ACK] Seq=235 Ack=35514 Win=64512 Len=0"
"349","50.856115","127.0.0.1","127.0.0.1","TLSv1.3","82","Application Data"
"350","50.856135","127.0.0.1","127.0.0.1","TCP","44","60342  >  60332 [ACK] Seq=9961 Ack=4460 Win=60928 Len=0"
"351","50.856177","127.0.0.1","127.0.0.1","TLSv1.3","114","Application Data"
"352","50.856191","127.0.0.1","127.0.0.1","TCP","44","60342  >  60332 [ACK] Seq=9961 Ack=4530 Win=60928 Len=0"
"353","50.857104","127.0.0.1","127.0.0.1","TLSv1.3","93","Application Data"
"354","50.857136","127.0.0.1","127.0.0.1","TCP","44","60332  >  60342 [ACK] Seq=4530 Ack=10010 Win=55296 Len=0"
"355","50.857578","127.0.0.1","127.0.0.1","TLSv1.3","114","Application Data"
"356","50.857600","127.0.0.1","127.0.0.1","TCP","44","60342  >  60332 [ACK] Seq=10010 Ack=4600 Win=60928 Len=0"
"357","50.857631","127.0.0.1","127.0.0.1","TLSv1.3","162","Application Data"
"358","50.857641","127.0.0.1","127.0.0.1","TCP","44","60342  >  60332 [ACK] Seq=10010 Ack=4718 Win=60672 Len=0"
"359","51.446938","127.0.0.1","127.0.0.1","TLSv1.3","20725","Application Data, Application Data"
"360","51.447005","127.0.0.1","127.0.0.1","TCP","44","60332  >  60342 [ACK] Seq=4718 Ack=30691 Win=34816 Len=0"
"361","51.447312","127.0.0.1","127.0.0.1","TCP","67","60346  >  60340 [PSH, ACK] Seq=35514 Ack=235 Win=65280 Len=23"
"362","51.447337","127.0.0.1","127.0.0.1","TCP","44","60340  >  60346 [ACK] Seq=235 Ack=35537 Win=64512 Len=0"
"363","51.447394","127.0.0.1","127.0.0.1","TCP","210","60346  >  60340 [PSH, ACK] Seq=35537 Ack=235 Win=65280 Len=166"
"364","51.447407","127.0.0.1","127.0.0.1","TCP","44","60340  >  60346 [ACK] Seq=235 Ack=35703 Win=64256 Len=0"
"365","51.447669","127.0.0.1","127.0.0.1","TLSv1.3","79","Application Data"
"366","51.447688","127.0.0.1","127.0.0.1","TCP","44","60342  >  60332 [ACK] Seq=30691 Ack=4753 Win=60672 Len=0"
"367","51.447715","127.0.0.1","127.0.0.1","TLSv1.3","157","Application Data"
"368","51.447725","127.0.0.1","127.0.0.1","TCP","44","60342  >  60332 [ACK] Seq=30691 Ack=4866 Win=60416 Len=0"
"369","51.447730","127.0.0.1","127.0.0.1","TCP","67","60346  >  60340 [PSH, ACK] Seq=35703 Ack=235 Win=65280 Len=23"
"370","51.447746","127.0.0.1","127.0.0.1","TCP","44","60340  >  60346 [ACK] Seq=235 Ack=35726 Win=64256 Len=0"
"371","51.447807","127.0.0.1","127.0.0.1","TCP","211","60346  >  60340 [PSH, ACK] Seq=35726 Ack=235 Win=65280 Len=167"
"372","51.447825","127.0.0.1","127.0.0.1","TCP","44","60340  >  60346 [ACK] Seq=235 Ack=35893 Win=64256 Len=0"
"373","51.447913","127.0.0.1","127.0.0.1","TCP","66","60346  >  60340 [PSH, ACK] Seq=35893 Ack=235 Win=65280 Len=22"
"374","51.447933","127.0.0.1","127.0.0.1","TCP","44","60340  >  60346 [ACK] Seq=235 Ack=35915 Win=64000 Len=0"
"375","51.447986","127.0.0.1","127.0.0.1","TCP","108","60346  >  60340 [PSH, ACK] Seq=35915 Ack=235 Win=65280 Len=64"
"376","51.448005","127.0.0.1","127.0.0.1","TCP","44","60340  >  60346 [ACK] Seq=235 Ack=35979 Win=64000 Len=0"
"377","51.475011","127.0.0.1","127.0.0.1","TLSv1.3","3387","Application Data"
"378","51.475067","127.0.0.1","127.0.0.1","TCP","44","60332  >  60342 [ACK] Seq=4866 Ack=34034 Win=65280 Len=0"
"379","51.476339","127.0.0.1","127.0.0.1","TCP","67","60346  >  60340 [PSH, ACK] Seq=35979 Ack=235 Win=65280 Len=23"
"380","51.476367","127.0.0.1","127.0.0.1","TCP","44","60340  >  60346 [ACK] Seq=235 Ack=36002 Win=64000 Len=0"
"381","51.476408","127.0.0.1","127.0.0.1","TCP","523","60346  >  60340 [PSH, ACK] Seq=36002 Ack=235 Win=65280 Len=479"
